{
  "schemaVersion": 1,
  "scope": {
    "level": "app"
  },
  "extends": null,
  "preamble": "Temporary Links is a Home Assistant add-on with which an operator hands a person outside the household a **temporary link**: a shareable, time-boxed, usage-limited authorization to trigger a predefined set of home actions (open a gate, unlock a door, start a scene). The operator composes the link in the add-on's dashboard (reached through the home's authenticated panel), chooses the actions, a validity window, a usage allowance, and a recipient, and delivers the link by SMS. The recipient opens the link's public trigger URL; the home runs the actions; the add-on accounts for the use and retires the link when its allowance is spent, its window ends, or the operator revokes it. Every consequential event lands in an audit trail. The add-on is the bookkeeper and gatekeeper of this lifecycle: the home hosts the trigger and runs the actions; the add-on decides whether a presented link is still good, records what happened, and cleans the trigger out of the home when the link dies.\n\nThis file is the specification of that product — the facit against which the implementation is judged and from which it could, in principle, be regenerated. It is written as user stories with acceptance criteria, grouped into epics, in conceptual vocabulary only: it names no type, class, file, or method.",
  "howToRead": "Roles: the **operator** (the home's administrator, working in the dashboard), the **recipient** (the person given a link, outside the household), and **the add-on** (for autonomous behaviour such as expiry sweeps). Stories are 'As a [role], I want [capability], so that [benefit]' with numbered Given/When/Then acceptance criteria. Each AC is concrete and falsifiable — it must map directly to a test. Where today's code differs from an AC, that difference belongs in the gap, never softened here.",
  "glossary": [
    {
      "id": "G.temporary-link",
      "term": "temporary link",
      "definition": "A shareable, time-boxed, usage-limited authorization to trigger a predefined set of home actions. Owns a token, a validity window, a usage allowance, a recipient, an optional custom message, a status, and its audit history."
    },
    {
      "id": "G.token",
      "term": "token",
      "definition": "The link's high-entropy secret identifier: 32 characters, URL-safe alphabet, generated from a cryptographically secure random source, unique across all links."
    },
    {
      "id": "G.home",
      "term": "home",
      "definition": "The home automation system (Home Assistant) the add-on serves: it hosts each link's trigger, runs the link's actions, and provides the authenticated panel through which the operator reaches the dashboard."
    },
    {
      "id": "G.trigger-url",
      "term": "trigger URL",
      "definition": "The public, internet-reachable URL (a cloud-relayed webhook) a recipient opens to use a link. Hosted by the home's cloud relay; fetching it fires the link's trigger in the home."
    },
    {
      "id": "G.actions",
      "term": "actions",
      "definition": "The set of home service calls a link performs when triggered, expressed as structured data. Chosen by the operator at creation, optionally from an action template."
    },
    {
      "id": "G.validity-window",
      "term": "validity window",
      "definition": "The from/until interval outside of which a link refuses to execute: before it, the link is not yet valid; after it, the link is expired."
    },
    {
      "id": "G.usage-allowance",
      "term": "usage allowance",
      "definition": "The maximum number of successful uses a link permits (at least one), together with the count of uses recorded so far."
    },
    {
      "id": "G.link-status",
      "term": "link status",
      "definition": "The link's lifecycle state: active (usable), used (allowance spent), expired (window ended), revoked (withdrawn by the operator). Used, expired, and revoked are terminal."
    },
    {
      "id": "G.delivery",
      "term": "delivery",
      "definition": "Sending a link to its recipient by SMS through the configured messaging provider, using a message composed from a template."
    },
    {
      "id": "G.message-template",
      "term": "message template",
      "definition": "The text a delivery is composed from — the link's custom message if present, otherwise the configured default — with placeholders for the trigger URL, the window's start and end, and the link's name."
    },
    {
      "id": "G.contact",
      "term": "contact",
      "definition": "A reusable recipient: a name and phone number (optionally email and notes) the operator keeps to avoid retyping recipients."
    },
    {
      "id": "G.action-template",
      "term": "action template",
      "definition": "A named, reusable set of actions the operator keeps to avoid recomposing common action sets."
    },
    {
      "id": "G.audit-trail",
      "term": "audit trail",
      "definition": "The append-only record of consequential events in a link's life — creation, amendment, delivery outcomes, every execution attempt and its verdict, trigger cleanup, revocation, expiry — each with a timestamp, a description, and success or failure."
    },
    {
      "id": "G.dashboard",
      "term": "dashboard",
      "definition": "The add-on's operator-facing web UI: overview, link management, contacts, action templates, and the audit log. Reached only through the home's authenticated panel; the add-on itself imposes no separate login."
    },
    {
      "id": "G.sweep",
      "term": "expiry sweep",
      "definition": "The add-on's periodic autonomous pass that finds active links whose validity window has ended, marks them expired, and removes their triggers from the home."
    }
  ],
  "epics": [
    {
      "id": "E1",
      "title": "The link and its lifecycle",
      "framing": "A temporary link is the product's one noun. It is born active with a fresh token and a hosted trigger, may be amended while active, and dies exactly one of three deaths: used up, expired, or revoked. Death is terminal, and a dead link's trigger does not linger in the home.",
      "stories": [
        {
          "id": "E1.S1",
          "role": "the operator",
          "want": "to create a temporary link by naming it, choosing its actions, its validity window, its usage allowance, and its recipient",
          "soThat": "I can hand out narrowly-scoped, self-expiring access to my home without sharing credentials.",
          "acceptanceCriteria": [
            {
              "id": "E1.S1.A1",
              "text": "Given valid details (a name, actions, a validity window, an allowance of at least one use, and optionally a recipient phone number), when the operator creates the link, then a link exists with status active, a zero usage count, and a fresh unique token."
            },
            {
              "id": "E1.S1.A2",
              "text": "Given a link is being created, when creation completes, then the home hosts a trigger for the link and the link records the public trigger URL that fires it."
            },
            {
              "id": "E1.S1.A3",
              "text": "Given a link is created, when the audit trail is consulted, then it records the creation, who created it, and the granted allowance."
            },
            {
              "id": "E1.S1.A4",
              "text": "Given the home cannot host the trigger, when creation fails, then no link is persisted and no orphaned trigger or half-registered artifact remains in the home."
            },
            {
              "id": "E1.S1.A5",
              "text": "Given creation fails for any reason, when the operator is back on the creation form, then the failure is explained and the operator's entries are preserved for correction."
            },
            {
              "id": "E1.S1.A6",
              "text": "Given actions in any accepted form (including the home's own automation syntax for a service call), when a link is created, then the actions are validated and normalized at creation to exactly the contract execution enforces — a link accepted at creation can never later fail on the form of its actions, and a form creation would reject is refused with a clear explanation."
            }
          ]
        },
        {
          "id": "E1.S2",
          "role": "the operator",
          "want": "to amend an active link's validity window, recipient, custom message, and allowance",
          "soThat": "I can extend or retarget access I have already handed out without minting a new link.",
          "acceptanceCriteria": [
            {
              "id": "E1.S2.A1",
              "text": "Given an active link, when the operator amends its window, recipient, custom message, or allowance, then the link reflects the amendment and the amendment is audited with the new values."
            },
            {
              "id": "E1.S2.A2",
              "text": "Given a link that is not active (used, expired, or revoked), when an amendment is attempted, then it is refused and the link is unchanged."
            },
            {
              "id": "E1.S2.A3",
              "text": "Given a link with recorded uses, when an amendment would set the allowance below the recorded usage count, then it is refused and the link is unchanged."
            },
            {
              "id": "E1.S2.A4",
              "text": "Given a link, when it is amended, then its name, actions, token, and trigger URL are not amendable — access-defining identity is fixed at creation."
            },
            {
              "id": "E1.S2.A5",
              "text": "Given an active link, when its validity window is amended, then the home-side trigger guard is re-armed to the new window before the amendment is saved — the old window no longer governs what the home will run."
            }
          ]
        },
        {
          "id": "E1.S3",